{
  "schemaVersion": 1,
  "date": "2026-08-11",
  "practiceTimezone": "America/Los_Angeles",
  "focus": "Career Walkthrough and Experience Map: VortexNetTech",
  "sessions": [],
  "timerGroups": [
    {
      "id": "2026-08-08-extra-voice-behavioral-plan-resume-career-walkthrough-2026-08-08-v1-0",
      "label": "Career Walkthrough: Tell me about yourself",
      "allocatedSeconds": 3600,
      "activityIds": [
        "2026-08-08-extra-voice-behavioral-plan-resume-career-walkthrough-2026-08-08-v1-0"
      ]
    },
    {
      "id": "2026-08-10-extra-voice-plan-resume-map-vortexnettech-2026-08-10-v1-0",
      "label": "Experience Map: VortexNetTech",
      "allocatedSeconds": 3600,
      "activityIds": [
        "2026-08-10-extra-voice-plan-resume-map-vortexnettech-2026-08-10-v1-0"
      ]
    }
  ],
  "activities": [
    {
      "schemaVersion": 2,
      "id": "2026-08-08-extra-voice-behavioral-plan-resume-career-walkthrough-2026-08-08-v1-0",
      "questionId": "resume-career-walkthrough",
      "date": "2026-08-11",
      "source": "extra",
      "type": "behavioral",
      "recordKind": "attempt",
      "title": "Career Walkthrough: Tell me about yourself",
      "allocatedSeconds": 3600,
      "timerGroupId": "2026-08-08-extra-voice-behavioral-plan-resume-career-walkthrough-2026-08-08-v1-0",
      "timingSource": "website",
      "startedAt": "2026-08-08T19:17:36.915-07:00",
      "endedAt": "2026-08-11T18:49:07.961-07:00",
      "elapsedSeconds": 9188,
      "status": "completed",
      "artifactPath": "practice/behavioral/sessions/2026-08-11-career-walkthrough-attempt-01.md"
    },
    {
      "schemaVersion": 2,
      "id": "2026-08-10-extra-voice-plan-resume-map-vortexnettech-2026-08-10-v1-0",
      "questionId": "resume-map-vortexnettech",
      "date": "2026-08-11",
      "source": "extra",
      "type": "behavioral",
      "recordKind": "attempt",
      "title": "Experience Map: VortexNetTech",
      "allocatedSeconds": 3600,
      "timerGroupId": "2026-08-10-extra-voice-plan-resume-map-vortexnettech-2026-08-10-v1-0",
      "timingSource": "website",
      "startedAt": "2026-08-10T02:35:30.890-07:00",
      "endedAt": "2026-08-11T18:49:09.188-07:00",
      "elapsedSeconds": 5130,
      "status": "completed",
      "artifactPath": "practice/behavioral/sessions/2026-08-11-experience-map-vortexnettech-attempt-01.md"
    }
  ]
}

